,title,description,image
1,All Quiet on the Western Front,A young German soldier's terrifying experiences and distress on the western front during World War I.,https://m.media-amazon.com/images/M/MV5BYTE1MmZiMWYtYTFmZi00YjA3LWI2ODgtMWFlNWYxZjdmNGE3XkEyXkFqcGdeQXVyNjk1Njg5NTA@.jpg
2,Devotion,A pair of U.S. Navy fighter pilots risk their lives during the Korean War and become some of the Navy's most celebrated wingmen.,https://m.media-amazon.com/images/M/MV5BMjI5NGJjMmEtODk4Yy00ZDRjLWE5ZGItMjJiNGM4NTI0NmZkXkEyXkFqcGdeQXVyNjk1Njg5NTA@.jpg
5,The Expendables 4,The Expendables will square up against: an arms dealer who commands the might of a massive private army.,https://m.media-amazon.com/images/M/MV5BNGIzNjU5YTctMDllZi00MGU2LWI5MTYtYzc4ZGFjNzY5ZjYyXkEyXkFqcGdeQXVyODY5NzkyMjA@.jpg
6,1917,"April 6th, 1917. As an infantry battalion assembles to wage war deep in enemy territory, two soldiers are assigned to race against time and deliver a message that will stop 1,600 men from walking straight into a deadly trap.",https://m.media-amazon.com/images/M/MV5BOTdmNTFjNDEtNzg0My00ZjkxLTg1ZDAtZTdkMDc2ZmFiNWQ1XkEyXkFqcGdeQXVyNTAzNzgwNTg@.jpg
11,Saving Private Ryan,"Following the Normandy Landings, a group of U.S. soldiers go behind enemy lines to retrieve a paratrooper whose brothers have been killed in action.",https://m.media-amazon.com/images/M/MV5BZjhkMDM4MWItZTVjOC00ZDRhLThmYTAtM2I5NzBmNmNlMzI1XkEyXkFqcGdeQXVyNDYyMDk5MTU@.jpg
12,Wonder Woman,"When a pilot crashes and tells of conflict in the outside world, Diana, an Amazonian warrior in training, leaves home to fight a war, discovering her full powers and true destiny.",https://m.media-amazon.com/images/M/MV5BMTYzODQzYjQtNTczNC00MzZhLTg1ZWYtZDUxYmQ3ZTY4NzA1XkEyXkFqcGdeQXVyODE5NzE3OTE@.jpg
14,Dunkirk,"Allied soldiers from Belgium, the British Commonwealth and Empire, and France are surrounded by the German Army and evacuated during a fierce battle in World War II.",https://m.media-amazon.com/images/M/MV5BN2YyZjQ0NTEtNzU5MS00NGZkLTg0MTEtYzJmMWY3MWRhZjM2XkEyXkFqcGdeQXVyMDA4NzMyOA@@.jpg
16,Full Metal Jacket,A pragmatic U.S. Marine observes the dehumanizing effects the Vietnam War has on his fellow recruits from their brutal boot camp training to the bloody street fighting in Hue.,https://m.media-amazon.com/images/M/MV5BNzkxODk0NjEtYjc4Mi00ZDI0LTgyYjEtYzc1NDkxY2YzYTgyXkEyXkFqcGdeQXVyNzkwMjQ5NzM@.jpg
17,Atonement,Thirteen-year-old fledgling writer Briony Tallis irrevocably changes the course of several lives when she accuses her older sister's lover of a crime he did not commit.,https://m.media-amazon.com/images/M/MV5BMGRiYjE0YzItMzk3Zi00ZmYwLWJjNDktYTAwYjIwMjIxYzM3XkEyXkFqcGdeQXVyMTMxODk2OTU@.jpg
18,Come and See,"After finding an old rifle, a young boy joins the Soviet resistance movement against ruthless German forces and experiences the horrors of World War II.",https://m.media-amazon.com/images/M/MV5BNzU3OTI1MjItYTJiZC00NDI0LWFlNGYtOTQ1OTVhNDgwM2U3XkEyXkFqcGdeQXVyNTc2MDU0NDE@.jpg
19,Life Is Beautiful,"When an open-minded Jewish waiter and his son become victims of the Holocaust, he uses a perfect mixture of will, humor, and imagination to protect his son from the dangers around their camp.",https://m.media-amazon.com/images/M/MV5BYmJmM2Q4NmMtYThmNC00ZjRlLWEyZmItZTIwOTBlZDQ3NTQ1XkEyXkFqcGdeQXVyMTQxNzMzNDI@.jpg
20,Operation Mincemeat,"During WWII, two intelligence officers use a corpse and false papers to outwit German troops.",https://m.media-amazon.com/images/M/MV5BOGZlNjZhNjgtMjQzZC00MDI0LWFmNGQtNmNiYTIyYTE3ODhkXkEyXkFqcGdeQXVyMDA4NzMyOA@@.jpg
22,Brothers,"While on tour in Afghanistan, Sam's copter is shot down and he is presumed dead. Back home, it is his screw-up brother who looks after the family. Sam does return, but with a lot of excess baggage.",https://m.media-amazon.com/images/M/MV5BMTkyMTY5MTcxOV5BMl5BanBnXkFtZTcwMTI3MDE3Mg@@.jpg
24,The Hunger Games: The Ballad of Songbirds and Snakes,Coriolanus Snow mentors and develops feelings for the female District 12 tribute during the 10th Hunger Games.,https://m.media-amazon.com/images/M/MV5BMWNiYWNkYWYtZWYwMi00NjNjLTk2ZTAtYmMwNzExNjYwY2U2XkEyXkFqcGdeQXVyMTMzMTc1NzU2.jpg
25,The Boy in the Striped Pajamas,"Through the innocent eyes of Bruno, the eight-year-old son of the commandant at a German concentration camp, a forbidden friendship with a Jewish boy on the other side of the camp fence has startling and unexpected consequences.",https://m.media-amazon.com/images/M/MV5BMTMzMTc3MjA5NF5BMl5BanBnXkFtZTcwOTk3MDE5MQ@@.jpg
26,Fury,"A grizzled tank commander makes tough decisions as he and his crew fight their way across Germany in April, 1945.",https://m.media-amazon.com/images/M/MV5BMjA4MDU0NTUyN15BMl5BanBnXkFtZTgwMzQxMzY4MjE@.jpg
27,Jojo Rabbit,A young German boy in the Hitler Youth whose hero and imaginary friend is the country's dictator is shocked to discover that his mother is hiding a Jewish girl in their home.,https://m.media-amazon.com/images/M/MV5BZjU0Yzk2MzEtMjAzYy00MzY0LTg2YmItM2RkNzdkY2ZhN2JkXkEyXkFqcGdeQXVyNDg4NjY5OTQ@.jpg
29,Kingdom of Heaven,"Balian of Ibelin travels to Jerusalem during the Crusades of the 12th century, and there he finds himself as the defender of the city and its people.",https://m.media-amazon.com/images/M/MV5BMTI2ODhkMjMtYWU2Yy00MjI1LThlNDctZTJmNDE2MDE4ZDYzXkEyXkFqcGdeQXVyMjUzOTY1NTc@.jpg
31,The Forgotten Battle,"1944, the Second World War. A British glider pilot, a Dutch boy fighting on the German side and a Dutch female resistance member all end up involved in the Battle of the Schelde. Their choices differ, but their goal is the same: freedom.",https://m.media-amazon.com/images/M/MV5BM2MzMzRlMTctM2QxMC00NTBiLWIwMTctMzEzODZmOGIxMjdhXkEyXkFqcGdeQXVyMjAyMDMyMzU@.jpg
32,The Patriot,Peaceful farmer Benjamin Martin is driven to lead the Colonial Militia during the American Revolution when a sadistic British officer murders his son.,https://m.media-amazon.com/images/M/MV5BMTkzMjE4ODU0MV5BMl5BanBnXkFtZTYwNTI2OTk2.jpg
35,Legends of the Fall,"In the early 1900s, three brothers and their father living in the remote wilderness of Montana are affected by betrayal, history, love, nature, and war.",https://m.media-amazon.com/images/M/MV5BMTYwMjYxNTAyN15BMl5BanBnXkFtZTgwMTc3MjkyMTE@.jpg
37,Platoon,"Chris Taylor, a neophyte recruit in Vietnam, finds himself caught in a battle of wills between two sergeants, one good and the other evil. A shrewd examination of the brutality of war and the duality of man in conflict.",https://m.media-amazon.com/images/M/MV5BMzRjZjdlMjQtODVkYS00N2YzLWJlYWYtMGVlN2E5MWEwMWQzXkEyXkFqcGdeQXVyMTQxNzMzNDI@.jpg
38,Downfall,"Traudl Junge, the final secretary for Adolf Hitler, tells of the Nazi dictator's final days in his Berlin bunker at the end of WWII.",https://m.media-amazon.com/images/M/MV5BMTU0NTU5NTAyMl5BMl5BanBnXkFtZTYwNzYwMDg2.jpg
40,Black Hawk Down,"The story of 160 elite U.S. soldiers who dropped into Mogadishu in October 1993 to capture two top lieutenants of a renegade warlord, but found themselves in a desperate battle with a large force of heavily-armed Somalis.",https://m.media-amazon.com/images/M/MV5BYWMwMzQxZjQtODM1YS00YmFiLTk1YjQtNzNiYWY1MDE4NTdiXkEyXkFqcGdeQXVyNDYyMDk5MTU@.jpg
41,Gone with the Wind,The manipulative daughter of a Georgia plantation owner conducts a turbulent romance with a roguish profiteer during the American Civil War and Reconstruction periods.,https://m.media-amazon.com/images/M/MV5BYjUyZWZkM2UtMzYxYy00ZmQ3LWFmZTQtOGE2YjBkNjA3YWZlXkEyXkFqcGdeQXVyNzkwMjQ5NzM@.jpg
43,Lawrence of Arabia,"The story of T.E. Lawrence, the English officer who successfully united and led the diverse, often warring, Arab tribes during World War I in order to fight the Turks.",https://m.media-amazon.com/images/M/MV5BYWY5ZjhjNGYtZmI2Ny00ODM0LWFkNzgtZmI1YzA2N2MxMzA0XkEyXkFqcGdeQXVyNjUwNzk3NDc@.jpg
44,American Sniper,"Navy S.E.A.L. sniper Chris Kyle's pinpoint accuracy saves countless lives on the battlefield and turns him into a legend. Back home with his family after four tours of duty, however, Chris finds that it is the war he can't leave behind.",https://m.media-amazon.com/images/M/MV5BMTkxNzI3ODI4Nl5BMl5BanBnXkFtZTgwMjkwMjY4MjE@.jpg
46,Barry Lyndon,An Irish rogue wins the heart of a rich widow and assumes her dead husband's aristocratic position in 18th-century England.,https://m.media-amazon.com/images/M/MV5BNmY0MWY2NDctZDdmMi00MjA1LTk0ZTQtZDMyZTQ1NTNlYzVjXkEyXkFqcGdeQXVyMjUzOTY1NTc@.jpg
47,Dr. Strangelove or: How I Learned to Stop Worrying and Love the Bomb,"An insane American general orders a bombing attack on the Soviet Union, triggering a path to nuclear holocaust that a war room full of politicians and generals frantically tries to stop.",https://m.media-amazon.com/images/M/MV5BZWI3ZTMxNjctMjdlNS00NmUwLWFiM2YtZDUyY2I3N2MxYTE0XkEyXkFqcGdeQXVyNzkwMjQ5NzM@.jpg
48,Grave of the Fireflies,A young boy and his little sister struggle to survive in Japan during World War II.,https://m.media-amazon.com/images/M/MV5BZmY2NjUzNDQtNTgxNC00M2Q4LTljOWQtMjNjNDBjNWUxNmJlXkEyXkFqcGdeQXVyNTA4NzY1MzY@.jpg
50,The Deer Hunter,An in-depth examination of the ways in which the Vietnam War impacts and disrupts the lives of several friends in a small steel mill town in Pennsylvania.,https://m.media-amazon.com/images/M/MV5BNDhmNTA0ZDMtYjhkNS00NzEzLWIzYTItOGNkMTVmYjE2YmI3XkEyXkFqcGdeQXVyNzkwMjQ5NzM@.jpg
51,War Dogs,"Loosely based on the true story of two young men, David Packouz and Efraim Diveroli, who won a three hundred million dollar contract from the Pentagon to arm America's allies in Afghanistan.",https://m.media-amazon.com/images/M/MV5BMjEyNzQ0NzM4MV5BMl5BanBnXkFtZTgwMDI0ODM2OTE@.jpg
60,Mulan,A young Chinese maiden disguises herself as a male warrior in order to save her father.,https://m.media-amazon.com/images/M/MV5BNDliY2E1MjUtNzZkOS00MzJlLTgyOGEtZDg4MTI1NzZkMTBhXkEyXkFqcGdeQXVyNjMwMzc3MjE@.jpg
65,The English Patient,"At the close of World War II, a young nurse tends to a badly-burned plane crash victim. His past is shown in flashbacks, revealing an involvement in a fateful love affair.",https://m.media-amazon.com/images/M/MV5BOTkxZTdkNTQtM2QwOS00NzRlLWEyMGItYTcxOTE4NTgyNGVhXkEyXkFqcGdeQXVyMTQxNzMzNDI@.jpg
66,Master and Commander: The Far Side of the World,"During the Napoleonic Wars, a brash British captain pushes his ship and crew to their limits in pursuit of a formidable French war vessel around South America.",https://m.media-amazon.com/images/M/MV5BZGRjM2IyM2EtZDAxYi00NTdjLTliMGYtMmRhZGUyNjRjNWYwXkEyXkFqcGdeQXVyODE5NzE3OTE@.jpg
67,Cold Mountain,"In the waning days of the American Civil War, a wounded soldier embarks on a perilous journey back home to Cold Mountain, North Carolina to reunite with his sweetheart.",https://m.media-amazon.com/images/M/MV5BMTY3NTc5NzcyOF5BMl5BanBnXkFtZTcwMDM0NjQyMQ@@.jpg
69,The Boat,A German U-boat stalks the frigid waters of the North Atlantic as its young crew experience the sheer terror and claustrophobic life of a submariner in World War II.,https://m.media-amazon.com/images/M/MV5BNDBjMWUxNTUtNjZiNi00YzJhLTgzNzUtMTRiY2FkZmMzYTNjXkEyXkFqcGdeQXVyMTUzMDUzNTI3.jpg
76,Outlaw King,A true David vs. Goliath story of how the 14th century Scottish 'Outlaw King' Robert the Bruce used cunning and bravery to defeat the much larger and better equipped occupying English army.,https://m.media-amazon.com/images/M/MV5BMTc4MTU4YzEtODBiNC00NzA4LTg0NGItM2ZhZjZlNDFiNjJjXkEyXkFqcGdeQXVyMDM2NDM2MQ@@.jpg
78,"Lust, Caution","During World War II era, a young woman, Wang Jiazhi, gets swept up in a dangerous game of emotional intrigue with a powerful political figure, Mr. Yee.",https://m.media-amazon.com/images/M/MV5BMTg2MGJjYmQtY2RjNy00NjczLWJlNDYtOWIzOGE2NGRjN2RhXkEyXkFqcGdeQXVyNjc3MjQzNTI@.jpg
82,Lincoln,"As the American Civil War continues to rage, America's president struggles with continuing carnage on the battlefield as he fights with many inside his own cabinet on the decision to emancipate the slaves.",https://m.media-amazon.com/images/M/MV5BMTQzNzczMDUyNV5BMl5BanBnXkFtZTcwNjM2ODEzOA@@.jpg
84,Enemy at the Gates,A Russian and a German sniper play a game of cat-and-mouse during the Battle of Stalingrad.,https://m.media-amazon.com/images/M/MV5BYWFlY2E3ODQtZWNiNi00ZGU4LTkzNWEtZTQ2ZTViMWRhYjIzL2ltYWdlXkEyXkFqcGdeQXVyNTAyODkwOQ@@.jpg
86,The Sum of All Fears,"CIA analyst Jack Ryan must stop the plans of a Neo-Nazi faction that threatens to induce a catastrophic conflict between the United States and Russia's President by detonating a nuclear weapon at a football game in Baltimore, Maryland.",https://m.media-amazon.com/images/M/MV5BZmFiZDkyYWQtMGNkZi00YmZkLThjNzAtY2U1YTVmYmNlNThmL2ltYWdlL2ltYWdlXkEyXkFqcGdeQXVyMTQxNzMzNDI@.jpg
87,Spartacus,"The life of Spartacus, the gladiator who lead a rebellion against the Romans. From his time as an ally of the Romans, to his betrayal and becoming a gladiator, to the rebellion he leads and its ultimate outcome.",https://m.media-amazon.com/images/M/MV5BZWQ4MjA2YzEtOTQzYi00NWQ1LWI0ZDEtN2VkZjhmYTc3MzU0XkEyXkFqcGdeQXVyNDIzMzcwNjc@.jpg
89,Overlord,A small group of American soldiers find horror behind enemy lines on the eve of D-Day.,https://m.media-amazon.com/images/M/MV5BYTUzYmJlNDgtMzM2ZS00N2ZkLWJjY2ItNzM0ZmVjMWU5OTA3XkEyXkFqcGdeQXVyMjQwMDg0Ng@@.jpg
90,The Bridge on the River Kwai,"British POWs are forced to build a railway bridge across the river Kwai for their Japanese captors in occupied Burma, not knowing that the allied forces are planning a daring commando raid through the jungle to destroy it.",https://m.media-amazon.com/images/M/MV5BOGY5NmNlMmQtYzRlYy00NGQ5LWFkYjYtNzExZmQyMTg0ZDA0XkEyXkFqcGdeQXVyNDIzMzcwNjc@.jpg
92,Green Street Hooligans,"A wrongfully expelled Harvard undergrad moves to London, where he is introduced to the violent underworld of football hooliganism.",https://m.media-amazon.com/images/M/MV5BMjExNTg3NzYwMV5BMl5BanBnXkFtZTcwMzcxMTEzMQ@@.jpg
93,Paths of Glory,"After refusing to attack an enemy position, a general accuses the soldiers of cowardice and their commanding officer must defend them.",https://m.media-amazon.com/images/M/MV5BOTI5Nzc0OTMtYzBkMS00NjkxLThmM2UtNjM2ODgxN2M5NjNkXkEyXkFqcGdeQXVyNjQ2MjQ5NzM@.jpg
95,Without Remorse,"An elite Navy SEAL, goes on a path to avenge his wife's murder only to find himself inside of a larger conspiracy.",https://m.media-amazon.com/images/M/MV5BNzcwYTUxYzctYTQ5My00YzY5LTk3YzItOTliMzRiOTZlMGI3XkEyXkFqcGdeQXVyMTEyMjM2NDc2.jpg
96,Ghosts of War,Five American soldiers assigned to hold a French Chateau near the end of World War II. This unexpected respite quickly descends into madness when they encounter a supernatural enemy more terrifying than anything seen on the battlefield.,https://m.media-amazon.com/images/M/MV5BMjAzYWVmN2QtOWM0Yi00ZTJiLWFkNzItOThmYTkxYzUzYTQyXkEyXkFqcGdeQXVyMzQwMTY2Nzk@.jpg
98,Valkyrie,"A dramatization of the July 20, 1944 assassination and political coup plot by desperate renegade German Army officers against Adolf Hitler during World War II.",https://m.media-amazon.com/images/M/MV5BMTg3Njc2ODEyN15BMl5BanBnXkFtZTcwNTAwMzc3NA@@.jpg
99,Tristan + Isolde,"An affair between the second in line to Britain's throne and the princess of the feuding Irish, spells doom for the young lovers.",https://m.media-amazon.com/images/M/MV5BMTRiZmY5ODMtNzI4Ny00YTE3LTgyYTgtZGE5MDZhZjAyMTQ1XkEyXkFqcGdeQXVyMTQxNzMzNDI@.jpg
100,Stripes,Two friends who are dissatisfied with their jobs decide to join the army for a bit of fun.,https://m.media-amazon.com/images/M/MV5BYTFiM2U0MjktNjUyMy00YzdhLWE0ZmUtNDUxNTA0MjhjZjBlXkEyXkFqcGdeQXVyMjUzOTY1NTc@.jpg
103,The Guernsey Literary and Potato Peel Pie Society,"In the aftermath of World War II, a writer forms an unexpected bond with the residents of Guernsey Island when she decides to write a book about their experiences during the war.",https://m.media-amazon.com/images/M/MV5BNjIyNzhhMmQtMjNlZS00MGRkLWE0ODgtY2E4MGMzMjk2M2IzXkEyXkFqcGdeQXVyMTMxODk2OTU@.jpg
105,Red Dawn,"It is the dawn of World War III. In the west mountains of America, a group of teenagers band together to defend their town, and their country, from invading Soviet forces.",https://m.media-amazon.com/images/M/MV5BMjFmOTI0MzYtOTEyZS00MjAzLThkMjMtOGFjOTllM2E0NTg4XkEyXkFqcGdeQXVyMTY5Nzc4MDY@.jpg
110,Megan Leavey,Based on the true life story of a young Marine corporal whose unique discipline and bond with her military combat dog saved many lives during their deployment in Iraq.,https://m.media-amazon.com/images/M/MV5BMTUxOTk2NTkxNF5BMl5BanBnXkFtZTgwOTUyOTM3MTI@.jpg
113,The Man with the Iron Heart,"As the German Fascists expand their borders, scorching Europe from end to end, two brave Czechs of the Resistance prepare for a suicide mission to assassinate Reinhard Heydrich, the hideous mastermind behind the ""Final Solution"".",https://m.media-amazon.com/images/M/MV5BNWY2ZGMxYTQtOGY1Mi00N2ZhLThkYzgtNDhlZjhlNzg4MWU0XkEyXkFqcGdeQXVyMTA4NjE0NjEy.jpg
116,Tolkien,"The formative years of the orphaned author J.R.R. Tolkien as he finds friendship, love and artistic inspiration among a group of fellow outcasts at school.",https://m.media-amazon.com/images/M/MV5BMjUzNzA1MDczOF5BMl5BanBnXkFtZTgwODY5OTI2NzM@.jpg
118,La Llorona,"Ignoring the eerie warning of a troubled mother suspected of child endangerment, a social worker and her own small kids are soon drawn into a frightening supernatural realm.",https://m.media-amazon.com/images/M/MV5BNjU4NjU4ZDktOTg2Ny00MWI2LThiMTAtMGFkZGE1MWI5MzhjXkEyXkFqcGdeQXVyODQxMTI4MjM@.jpg
120,From Here to Eternity,"At a U.S. Army base in 1941 Hawaii, a private is cruelly punished for not boxing on his unit's team, while his commanding officer's wife and top aide begin a tentative affair.",https://m.media-amazon.com/images/M/MV5BM2U3YzkxNGMtYWE0YS00ODk0LTk1ZGEtNjk3ZTE0MTk4MzJjXkEyXkFqcGdeQXVyNDk0MDg4NDk@.jpg
121,Hannibal Rising,"After the death of his parents during World War II, young Hannibal Lecter moves in with his beautiful aunt and begins plotting revenge on the barbarians responsible for his sister's death.",https://m.media-amazon.com/images/M/MV5BMTIzMTA0NTM4NF5BMl5BanBnXkFtZTcwNjY3ODM0MQ@@.jpg
123,Heartbreak Ridge,"Hard-nosed, hard-living Marine Gunnery Sergeant Tom Highway (Clint Eastwood) clashes with his superiors and his ex-wife as he takes command of a spoiled recon platoon with a bad attitude.",https://m.media-amazon.com/images/M/MV5BZWNiOTY4ZGUtYzM2Ny00ZTE2LThjZmEtNjI2MzA5NDRmNTczXkEyXkFqcGdeQXVyMjUzOTY1NTc@.jpg
127,The Lucky One,A Marine travels to Louisiana after serving three tours in Iraq and searches for the unknown woman he believes was his good luck charm during the war.,https://m.media-amazon.com/images/M/MV5BMTg5NDk3MjAzMF5BMl5BanBnXkFtZTcwMjUyNzExNw@@.jpg
128,Seven Years in Tibet,"True story of Heinrich Harrer, an Austrian mountain climber who became friends with the Dalai Lama at the time of China's takeover of Tibet.",https://m.media-amazon.com/images/M/MV5BYTNkMDMxMDMtMDlhNi00MzQxLTk4NTAtODc0YTFmNGVlNDAyXkEyXkFqcGdeQXVyMjUzOTY1NTc@.jpg
132,Where Eagles Dare,"Allied agents stage a daring raid on a castle where the Nazis are holding American brigadier general George Carnaby prisoner, but that's not all that's really going on.",https://m.media-amazon.com/images/M/MV5BNGE3ZWZiNzktMDIyOC00ZmVhLThjZTktZjQ5NjI4NGVhMDBlXkEyXkFqcGdeQXVyMjI4MjA5MzA@.jpg
134,A Hidden Life,"The Austrian Franz Jägerstätter, a conscientious objector, refuses to fight for the Nazis in World War II.",https://m.media-amazon.com/images/M/MV5BMDk4OTU0ZjctMjhhYS00YmVlLThlMDAtMjU4YzhlN2IyYzI3XkEyXkFqcGdeQXVyMTkxNjUyNQ@@.jpg
138,Operation Finale,A team of secret agents set out to track down the Nazi officer who masterminded the Holocaust.,https://m.media-amazon.com/images/M/MV5BYzE1YjI2MjctZTY2Zi00NDBhLWIzYmMtNzMzMDgwZjE4MzUxXkEyXkFqcGdeQXVyNTI4MzE4MDU@.jpg
139,The Monuments Men,An unlikely World War II platoon is tasked to rescue art masterpieces from Nazi thieves and return them to their owners.,https://m.media-amazon.com/images/M/MV5BMjMxMjk4NTM1M15BMl5BanBnXkFtZTgwNjg0MjQ3MDE@.jpg
144,Anthropoid,"Based on the extraordinary true story of Operation Anthropoid, the WWII mission to assassinate SS General Reinhard Heydrich, the main architect behind the Final Solution and the Reich's third in command after Hitler and Himmler.",https://m.media-amazon.com/images/M/MV5BMjIxNzE0NjY1Nl5BMl5BanBnXkFtZTgwNjYzOTkxOTE@.jpg
147,Stalingrad,A Russian and a German sniper play a game of cat-and-mouse during the Battle of Stalingrad.,https://m.media-amazon.com/images/M/MV5BYWFlY2E3ODQtZWNiNi00ZGU4LTkzNWEtZTQ2ZTViMWRhYjIzL2ltYWdlXkEyXkFqcGdeQXVyNTAyODkwOQ@@.jpg
149,The Longest Day,"The events of D-Day, told on a grand scale from both the Allied and German points of view.",https://m.media-amazon.com/images/M/MV5BZTM1ZjQ2YTktNDM2MS00NGY2LTkzNzItZTU4ODg1ODNkMWYxL2ltYWdlXkEyXkFqcGdeQXVyNjc1NTYyMjg@.jpg
150,War Machine,"An idiosyncratic general confronts opposition from enemies, allies, and bureaucrats while leading a massive rebuilding operation in Afghanistan.",https://m.media-amazon.com/images/M/MV5BMTcyMzgwNDE1M15BMl5BanBnXkFtZTgwMDAzMDM0MjI@.jpg
152,The Wall,A confined but troubled rock star descends into madness in the midst of his physical and social isolation from everyone.,https://m.media-amazon.com/images/M/MV5BMzYwMDZlZDktNGVlMC00OWVlLWI0MTktN2UwNTUxOWI1NjJhXkEyXkFqcGdeQXVyMzg1ODEwNQ@@.jpg
154,A Bridge Too Far,"Operation Market Garden, September 1944: The Allies attempt to capture several strategically important bridges in the Netherlands in the hope of breaking the German lines.",https://m.media-amazon.com/images/M/MV5BNWRjZmZmYmItYzczOS00NjY4LTk3ODItNGU3ZDQ2ZGJkYmZiXkEyXkFqcGdeQXVyMjUzOTY1NTc@.jpg
155,In the Name of the King: A Dungeon Siege Tale,"A man named Farmer sets out to rescue his kidnapped wife and avenge the death of his son, two acts committed by the Krugs, a race of animal-warriors who are controlled by the evil Gallian.",https://m.media-amazon.com/images/M/MV5BMTQ4ODI0ODA1Ml5BMl5BanBnXkFtZTcwNzMzMjU1MQ@@.jpg
157,Black Book,"In the Nazi-occupied Netherlands during World War II, a Jewish singer infiltrates the regional Gestapo headquarters for the Dutch resistance.",https://m.media-amazon.com/images/M/MV5BMTIzMjc2ODQ2NV5BMl5BanBnXkFtZTYwODkzNTA3.jpg
158,1941,Hysterical Californians prepare for a Japanese invasion in the days after Pearl Harbor.,https://m.media-amazon.com/images/M/MV5BNDVkYWM4YTktNGE3My00NDlkLTllMTAtNWQyOTZjYzEzNzg5XkEyXkFqcGdeQXVyMzExODEzNDA@.jpg
162,Kelly's Heroes,A group of U.S. soldiers sneaks across enemy lines to get their hands on a secret stash of Nazi treasure.,https://m.media-amazon.com/images/M/MV5BMzAyNDUwYzUtN2NlMC00ODliLWExMjgtMGMzNmYzZmUwYTg1XkEyXkFqcGdeQXVyNjc1NTYyMjg@.jpg
165,The Zookeeper's Wife,"Keepers of the Warsaw Zoo, Antonina and Jan Zabinski, must save hundreds of people and animals during the Nazi invasion in WWII Poland.",https://m.media-amazon.com/images/M/MV5BNTY3YmZmYmMtZjc3Zi00N2VjLWE5ZGMtN2M0ODkzOGQ5M2UyL2ltYWdlL2ltYWdlXkEyXkFqcGdeQXVyNTk1MTQ3NDI@.jpg
170,Born on the Fourth of July,"The biography of Ron Kovic. Paralyzed in the Vietnam war, he becomes an anti-war and pro-human rights political activist after feeling betrayed by the country for which he fought.",https://m.media-amazon.com/images/M/MV5BMTgwNDk5NTA0NF5BMl5BanBnXkFtZTgwMTkyMDUxMDE@.jpg
173,USS Indianapolis: Men of Courage,"During World War II, an American navy ship is sunk by a Japanese submarine leaving 890 crewmen stranded in shark infested waters.",https://m.media-amazon.com/images/M/MV5BYmYxYjAxNDItZWY2NC00MTE1LWIxNGMtZjkzOTM3MzIwM2RjXkEyXkFqcGdeQXVyNDI0MTYyNzU@.jpg
175,The Messenger: The Story of Joan of Arc,A young girl receives a vision that drives her to rid France of its oppressors.,https://m.media-amazon.com/images/M/MV5BZmIyYzliMjEtMjY5MC00YzFlLWI4ZjktMWYwMTA2NjEzODA0XkEyXkFqcGdeQXVyMjUzOTY1NTc@.jpg
179,Uncommon Valor,"Ten years after his son went M.I.A. in Vietnam, U.S. Marine retired Colonel Jason Rhodes assembles a private rescue team to find Americans held in P.O.W. camps in Laos.",https://m.media-amazon.com/images/M/MV5BNzE4ZjUxZTgtZTY1NS00MDU1LWIwNWYtOTg3M2M4YWM5ZDMyL2ltYWdlXkEyXkFqcGdeQXVyNjQzNDI3NzY@.jpg
182,Timeline,A group of archaeologists become trapped in the past when they go there to retrieve a friend. The group must survive in 14th-century France before they can escape back to the twenty-first century.,https://m.media-amazon.com/images/M/MV5BMTg5OTAyNDE3NV5BMl5BanBnXkFtZTYwOTkzMzE3.jpg
183,Fat Man and Little Boy,"This film reenacts the Manhattan Project, the secret wartime project in New Mexico where the first atomic bombs were designed and built.",https://m.media-amazon.com/images/M/MV5BMmUzNjY5NTAtODExZi00MDM5LWE0OGQtOWI0NGI3OTYzNmI3XkEyXkFqcGdeQXVyNjQzNDI3NzY@.jpg
184,The Aftermath,"Post World War II, a British colonel and his wife are assigned to live in Hamburg during the post-war reconstruction, but tensions arise with the German who previously owned the house.",https://m.media-amazon.com/images/M/MV5BMTk2MDEyNTE5M15BMl5BanBnXkFtZTgwMzY1NDM4NjM@.jpg
185,The Sand Pebbles,"In 1926, a U.S. Naval engineer gets assigned to a gunboat on a rescue mission in war-torn China.",https://m.media-amazon.com/images/M/MV5BNzM4NWQzNzAtNjc0Yy00NjFiLWFiMjUtMTczNWYwMGY1YjUyXkEyXkFqcGdeQXVyMjI4MjA5MzA@.jpg
188,Imperium,"A hip-hop mogul must choose a successor among his three sons who are battling for control over his multi-million dollar company, while his ex-wife schemes to reclaim what is hers.",https://m.media-amazon.com/images/M/MV5BOWY0ZmY1Y2MtYTY0OC00ODc4LTg1MjEtOTY2Yjg0MmM3MTZjXkEyXkFqcGdeQXVyMzQ2MDI5NjU@.jpg
189,Behind Enemy Lines,"A disillusioned pilot shot down over war-torn Bosnia is ensnared in the conflict in war-torn Bosnia. In the crosshairs of the enemy and an assassin, the spoiled pilot runs for his life as his commanding officer risks all to save him.",https://m.media-amazon.com/images/M/MV5BYzUyOTE4MjktZmU2Ni00OWI5LWJmNGQtNDRkZGIzMjdiY2JiXkEyXkFqcGdeQXVyMjUzOTY1NTc@.jpg
